{
  "schema_version": "1.0",
  "skill_id": "observe-scene",
  "skill_version": "1.0.0",
  "status": "candidate",
  "description": "从参考照片中提取可见元素、关系与不确定性，不输出构图结论。",
  "trigger": {
    "task_types": ["observe_scene"],
    "required_inputs": ["analysis_image"],
    "optional_context": ["scene_description", "environment_notes"]
  },
  "input_schema_version": {
    "schema_id": "scene-request",
    "version": "1.0.0"
  },
  "output_schema_version": {
    "schema_id": "scene-understanding",
    "version": "1.1.0"
  },
  "instruction_version": "1.0.0",
  "reference_version": "1.0.0",
  "validator_version": "1.0.0",
  "evaluation_set_version": "1.0.0",
  "compatible_runtime": {
    "minimum": "1.0.0",
    "maximum_exclusive": "2.0.0"
  },
  "provider_requirements": {
    "capabilities": ["vision", "structured_output", "tool_calling"],
    "minimum_context_tokens": 8192
  },
  "artifacts": {
    "instructions_path": "instructions.md",
    "reference_paths": ["references/visual-relations.md"],
    "example_paths": ["examples/valid-observation.json"],
    "negative_example_paths": ["examples/identity-inference.invalid.json"],
    "validator_id": "observe_scene_v1"
  },
  "content_hash": "sha256:aaaaaaaaaaaaaaaaaaaaaaaaaaaaaaaaaaaaaaaaaaaaaaaaaaaaaaaaaaaaaaaa",
  "created_at": "2026-07-24T08:00:00Z"
}
