{
  "schema_version": "1.0",
  "skill_id": "composition-relations",
  "skill_version": "1.0.0",
  "status": "active",
  "description": "基于已校验的画面理解提供不同观看关系、开放问题与现场尝试，不作审美排名。",
  "trigger": {
    "task_types": ["compose_relations"],
    "required_inputs": ["scene_understanding"],
    "optional_context": ["creative_intent", "movement_freedom", "gear_context"]
  },
  "input_schema_version": {
    "schema_id": "scene-understanding",
    "version": "1.1.0"
  },
  "output_schema_version": {
    "schema_id": "scene-analysis",
    "version": "4.3.0"
  },
  "instruction_version": "1.0.0",
  "reference_version": "1.0.0",
  "validator_version": "1.0.0",
  "evaluation_set_version": "1.0.0",
  "compatible_runtime": {
    "minimum": "1.0.0",
    "maximum_exclusive": "2.0.0"
  },
  "provider_requirements": {
    "capabilities": ["text", "structured_output", "tool_calling"],
    "minimum_context_tokens": 8192
  },
  "artifacts": {
    "instructions_path": "instructions.md",
    "reference_paths": ["references/visual-strategies.md"],
    "example_paths": ["examples/valid-direction.json"],
    "negative_example_paths": [
      "examples/judge-language.invalid.json",
      "examples/duplicate-directions.invalid.json",
      "examples/symbolism.invalid.json",
      "examples/unsafe-position.invalid.json",
      "examples/post-process-leak.invalid.json"
    ],
    "validator_id": "composition_relations_v1"
  },
  "content_hash": "sha256:0dbd685c43742e19a0bfb365a8899847d57ab5fd11ec92d0fb3e4ca536348613",
  "created_at": "2026-07-24T08:00:00Z"
}
